smartctl 6.5 (build date Oct  7 2021) [x86_64-linux-4.4.180+] (local build)
Copyright (C) 2002-16, Bruce Allen, Christian Franke, www.smartmontools.org

=== START OF INFORMATION SECTION ===
Model Family:     IronWolf 110
Device Model:     ZA480NM10001
Serial Number:    HKQ01KET
LU WWN Device Id: 5 000c50 03ea0bd1d
Firmware Version: SF44010J
User Capacity:    480,103,981,056 bytes [480 GB]
Sector Sizes:     512 bytes logical, 4096 bytes physical
Rotation Rate:    Solid State Device
Device is:        In smartctl database [for details use: -P show]
ATA Version is:   Unknown(0x0ffc), ACS-2 T13/2015-D revision 3
SATA Version is:  SATA >3.2 (0x1ff), 6.0 Gb/s (current: 6.0 Gb/s)
Local Time is:    Mon Jan 23 16:11:51 2023 CET
SMART support is: Available - device has SMART capability.
SMART support is: Enabled

=== START OF READ SMART DATA SECTION ===
SMART overall-health self-assessment test result: PASSED

General SMART Values:
Offline data collection status:  (0x02)	Offline data collection activity
					was completed without error.
					Auto Offline Data Collection: Disabled.
Self-test execution status:      (   0)	The previous self-test routine completed
					without error or no self-test has ever 
					been run.
Total time to complete Offline 
data collection: 		(    0) seconds.
Offline data collection
capabilities: 			 (0x59) SMART execute Offline immediate.
					No Auto Offline data collection support.
					Suspend Offline collection upon new
					command.
					Offline surface scan supported.
					Self-test supported.
					No Conveyance Self-test supported.
					Selective Self-test supported.
SMART capabilities:            (0x0002)	Does not save SMART data before
					entering power-saving mode.
					Supports SMART auto save timer.
Error logging capability:        (0x01)	Error logging supported.
					General Purpose Logging supported.
Short self-test routine 
recommended polling time: 	 (   1) minutes.
Extended self-test routine
recommended polling time: 	 (  30) minutes.
SCT capabilities: 	       (0x103d)	SCT Status supported.
					SCT Error Recovery Control supported.
					SCT Feature Control supported.
					SCT Data Table supported.

SMART Attributes Data Structure revision number: 11
Vendor Specific SMART Attributes with Thresholds:
ID# ATTRIBUTE_NAME                                                   FLAG     VALUE WORST THRESH TYPE      UPDATED  WHEN_FAILED RAW_VALUE
  1 Raw_Read_Error_Rate                                              0x002f   100   100   090    Pre-fail  Always       -       0
  5 Reallocated_Sector_Count                                         0x0032   100   100   000    Old_age   Always       -       0
  9 Power-On-Hours                                                   0x0032   100   100   000    Old_age   Always       -       901
 12 Power_Cycle_Count                                                0x0032   100   100   000    Old_age   Always       -       36
100 Flash_GB_Erased                                                  0x0032   100   100   000    Old_age   Always       -       114
102 Lifetime_PS4_Entry_Count                                         0x0032   100   100   000    Old_age   Always       -       70
103 Lifetime_PS3_Entry_Count                                         0x0032   100   100   000    Old_age   Always       -       0
170 Grown_Bad_Block_Count                                            0x0032   100   100   000    Old_age   Always       -       0
171 Program_Fail_Count                                               0x0032   100   100   000    Old_age   Always       -       0
172 Erase_Fail_Count                                                 0x0032   100   100   000    Old_age   Always       -       0
173 Average_Program/Erase_Count                                      0x0032   100   100   000    Old_age   Always       -       3
174 Unexpected_Power_Loss_Count                                      0x0032   100   100   000    Old_age   Always       -       13
177 Wear_Range_Delta                                                 0x0023   100   100   089    Pre-fail  Always       -       0
183 SATA/PCIe_Interface_Downshift_Count                              0x0032   100   100   000    Old_age   Always       -       0
187 Uncorrectable_ECC_Count                                          0x0032   100   100   000    Old_age   Always       -       0
194 Temperature_Celsius                                              0x0022   024   048   000    Old_age   Always       -       24 (Min/Max 18/48)
195 RAISE_ECC_Correctable_Count                                      0x0032   100   100   000    Old_age   Always       -       0
198 Uncorrectable_Read_Error_Count                                   0x0032   100   100   000    Old_age   Always       -       0
199 SATA_R-Error_(CRC)_Error_Count                                   0x0032   100   100   000    Old_age   Always       -       0
230 Drive_Life_Protection_Status                                     0x0023   100   100   091    Pre-fail  Always       -       100
231 SSD_Life_Left                                                    0x0033   100   100   010    Pre-fail  Always       -       6579200
232 Available_Reserved_Space                                         0x0027   100   100   003    Pre-fail  Always       -       0
233 Lifetime_Writes_to_Flash                                         0x0032   100   100   000    Old_age   Always       -       1209
241 Lifetime_Writes_from_Host                                        0x0032   100   100   000    Old_age   Always       -       3116
242 Lifetime_Reads_from_Host                                         0x0032   100   100   000    Old_age   Always       -       1892
243 Free_Space                                                       0x0026   100   078   003    Old_age   Always       -       42752104984639

SMART Error Log not supported

SMART Self-test log structure revision number 1
Num  Test_Description    Status                  Remaining  LifeTime(hours)  LBA_of_first_error
# 1  Extended offline    Completed without error       00%       778         -

SMART Selective self-test log data structure revision number 1
 SPAN  MIN_LBA  MAX_LBA  CURRENT_TEST_STATUS
    1        0        0  Not_testing
    2        0        0  Not_testing
    3        0        0  Not_testing
    4        0        0  Not_testing
    5        0        0  Not_testing
Selective self-test flags (0x0):
  After scanning selected spans, do NOT read-scan remainder of disk.
If Selective self-test is pending on power-up, resume after 0 minute delay.

