smartctl 6.5 (build date Oct  7 2021) [x86_64-linux-4.4.180+] (local build)
Copyright (C) 2002-16, Bruce Allen, Christian Franke, www.smartmontools.org

=== START OF INFORMATION SECTION ===
Model Family:     Western Digital Red
Device Model:     WDC WD40EFRX-68WT0N0
Serial Number:    WD-WCC4E0187364
LU WWN Device Id: 5 0014ee 2b3bb3b55
Firmware Version: 80.00A80
User Capacity:    4,000,787,030,016 bytes [4.00 TB]
Sector Sizes:     512 bytes logical, 4096 bytes physical
Rotation Rate:    5400 rpm
Device is:        In smartctl database [for details use: -P show]
ATA Version is:   ACS-2 (minor revision not indicated)
SATA Version is:  SATA 3.0, 6.0 Gb/s (current: 6.0 Gb/s)
Local Time is:    Mon Jan 23 16:11:52 2023 CET
SMART support is: Available - device has SMART capability.
SMART support is: Enabled

=== START OF READ SMART DATA SECTION ===
SMART overall-health self-assessment test result: PASSED

General SMART Values:
Offline data collection status:  (0x00)	Offline data collection activity
					was never started.
					Auto Offline Data Collection: Disabled.
Self-test execution status:      (   0)	The previous self-test routine completed
					without error or no self-test has ever 
					been run.
Total time to complete Offline 
data collection: 		(54240) seconds.
Offline data collection
capabilities: 			 (0x7b) SMART execute Offline immediate.
					Auto Offline data collection on/off support.
					Suspend Offline collection upon new
					command.
					Offline surface scan supported.
					Self-test supported.
					Conveyance Self-test supported.
					Selective Self-test supported.
SMART capabilities:            (0x0003)	Saves SMART data before entering
					power-saving mode.
					Supports SMART auto save timer.
Error logging capability:        (0x01)	Error logging supported.
					General Purpose Logging supported.
Short self-test routine 
recommended polling time: 	 (   2) minutes.
Extended self-test routine
recommended polling time: 	 ( 542) minutes.
Conveyance self-test routine
recommended polling time: 	 (   5) minutes.
SCT capabilities: 	       (0x703d)	SCT Status supported.
					SCT Error Recovery Control supported.
					SCT Feature Control supported.
					SCT Data Table supported.

SMART Attributes Data Structure revision number: 16
Vendor Specific SMART Attributes with Thresholds:
ID# ATTRIBUTE_NAME                                                   FLAG     VALUE WORST THRESH TYPE      UPDATED  WHEN_FAILED RAW_VALUE
  1 Raw_Read_Error_Rate                                              0x002f   199   188   051    Pre-fail  Always       -       3091
  3 Spin_Up_Time                                                     0x0027   172   170   021    Pre-fail  Always       -       8400
  4 Start_Stop_Count                                                 0x0032   100   100   000    Old_age   Always       -       201
  5 Reallocated_Sector_Ct                                            0x0033   196   196   140    Pre-fail  Always       -       132
  7 Seek_Error_Rate                                                  0x002e   200   200   000    Old_age   Always       -       0
  9 Power_On_Hours                                                   0x0032   078   078   000    Old_age   Always       -       16560
 10 Spin_Retry_Count                                                 0x0032   100   100   000    Old_age   Always       -       0
 11 Calibration_Retry_Count                                          0x0032   100   100   000    Old_age   Always       -       0
 12 Power_Cycle_Count                                                0x0032   100   100   000    Old_age   Always       -       193
192 Power-Off_Retract_Count                                          0x0032   200   200   000    Old_age   Always       -       80
193 Load_Cycle_Count                                                 0x0032   200   200   000    Old_age   Always       -       129
194 Temperature_Celsius                                              0x0022   123   110   000    Old_age   Always       -       29
196 Reallocated_Event_Count                                          0x0032   068   068   000    Old_age   Always       -       132
197 Current_Pending_Sector                                           0x0032   200   200   000    Old_age   Always       -       0
198 Offline_Uncorrectable                                            0x0030   100   253   000    Old_age   Offline      -       0
199 UDMA_CRC_Error_Count                                             0x0032   200   200   000    Old_age   Always       -       0
200 Multi_Zone_Error_Rate                                            0x0008   200   200   000    Old_age   Offline      -       0

SMART Error Log Version: 1
No Errors Logged

SMART Self-test log structure revision number 1
Num  Test_Description    Status                  Remaining  LifeTime(hours)  LBA_of_first_error
# 1  Extended offline    Completed without error       00%     16448         -
# 2  Short offline       Completed without error       00%     15845         -
# 3  Short offline       Completed without error       00%     16295         -
# 4  Short offline       Completed without error       00%     15552         -
# 5  Short offline       Completed without error       00%     14891         -
# 6  Short offline       Completed without error       00%     14544         -
# 7  Extended offline    Completed without error       00%     13385         -
# 8  Short offline       Completed without error       00%     13135         -
# 9  Short offline       Completed without error       00%     12390         -
#10  Short offline       Completed without error       00%     12864         -
#11  Short offline       Completed without error       00%     12121         -
#12  Short offline       Completed without error       00%     12570         -
#13  Extended offline    Completed without error       00%     11956         -
#14  Extended offline    Interrupted (host reset)      90%      9863         -
#15  Short offline       Completed without error       00%       131         -

SMART Selective self-test log data structure revision number 1
 SPAN  MIN_LBA  MAX_LBA  CURRENT_TEST_STATUS
    1        0        0  Not_testing
    2        0        0  Not_testing
    3        0        0  Not_testing
    4        0        0  Not_testing
    5        0        0  Not_testing
Selective self-test flags (0x0):
  After scanning selected spans, do NOT read-scan remainder of disk.
If Selective self-test is pending on power-up, resume after 0 minute delay.

